{
  "$schema": "https://json-schema.org/draft/2020-12/schema",
  "$id": "https://fsl.dev/schemas/fslc/kernel/replay-trace.v1.schema.json",
  "title": "FSL external replay trace v1",
  "type": "object",
  "additionalProperties": false,
  "required": ["$schema", "schema_version", "kernel_schema_version", "spec", "initial", "events"],
  "properties": {
    "$schema": { "const": "https://fsl.dev/schemas/fslc/kernel/replay-trace.v1.schema.json" },
    "schema_version": { "const": "1.0.0" },
    "kernel_schema_version": { "enum": ["1.0.0", "2.0.0"] },
    "spec": { "type": "string", "minLength": 1 },
    "initial": { "$ref": "#/$defs/state" },
    "events": {
      "type": "array",
      "items": { "$ref": "#/$defs/event" }
    }
  },
  "$defs": {
    "state": { "type": "object" },
    "event": {
      "type": "object",
      "additionalProperties": false,
      "required": ["tick", "action", "params", "state"],
      "properties": {
        "tick": { "type": "integer", "minimum": 1 },
        "timestamp": { "type": "string", "minLength": 1 },
        "action": { "type": "string", "minLength": 1 },
        "params": { "type": "object" },
        "state": { "$ref": "#/$defs/state" }
      }
    }
  }
}
